PubMedID,Entity_1,Entity_2,Sentence,BioBERT_Relation,PubMedBERT_Relation,BioLinkBERT_Relation,Final_Adjudicated_Relation
1493810,Interleukin-1 beta,motility factors,Interleukin-1 beta (Il-1 beta) and interleukin-1 alpha (Il-1 alpha) were shown to act as motility factors for the human breast carcinoma cell lines SK-BR-3 and ZR-75-1 in vitro.,NO_RELATION,NO_RELATION,NO_RELATION,NO_RELATION
1493936,Granulocyte-macrophage colony-stimulating factor,pleiotropic molecule,"Granulocyte-macrophage colony-stimulating factor (GM-CSF), a pleiotropic molecule which displays a broad range of haematopoietic activities, has become available for clinical evaluation in various patient groups.",NO_RELATION,NO_RELATION,NO_RELATION,NO_RELATION
1500182,Tumor necrosis factor,cytokines,"Tumor necrosis factor and related cytokines are thought to be implicated in cell-mediated immunity and pathophysiology in malaria, but their mechanism of action has not been ascertained.",NO_RELATION,NO_RELATION,NO_RELATION,NO_RELATION
1501572,Tumor necrosis factor,endogenously produced cytokine,"Tumor necrosis factor (TNF) is an endogenously produced cytokine that plays a critical role in mediating septic shock and multi-organ failure, but previous studies of the role TNF in disease have not examined its role in mucosal disease processes.",NO_RELATION,NO_RELATION,NO_RELATION,NO_RELATION
1512539,Interferon gamma,lymphokine,"Interferon gamma (IFN-gamma), a lymphokine that exerts multiple immunoregulatory effects, has been found to be elevated in the plasma, cerebrospinal fluid, and lymph nodes of human immunodeficiency virus (HIV)-infected individuals and has shown variable effects on HIV replication in acutely infected cells.",NO_RELATION,NO_RELATION,NO_RELATION,NO_RELATION
1512539,Interferon gamma,immunoregulatory,"Interferon gamma (IFN-gamma), a lymphokine that exerts multiple immunoregulatory effects, has been found to be elevated in the plasma, cerebrospinal fluid, and lymph nodes of human immunodeficiency virus (HIV)-infected individuals and has shown variable effects on HIV replication in acutely infected cells.",NO_RELATION,NO_RELATION,NO_RELATION,NO_RELATION
1517398,Interleukin-1 beta,corticotropin-releasing factor-41,Interleukin-1 beta (IL-1 beta) induces a dose-dependent increase in the release of corticotropin-releasing factor-41 (CRF) from dispersed rat fetal hypothalamic cells in culture.,NO_RELATION,NO_RELATION,NO_RELATION,NO_RELATION
1526987,Interleukin-2,receptor complex,Interleukin-2 (IL-2) and its receptor complex have become one of the most studied members of a growing family of protein hormones characterized by structural similarities in both ligands and their receptors.,NO_RELATION,NO_RELATION,NO_RELATION,NO_RELATION
